{
  "schema_version": "finding.v1",
  "finding_id": "8f7e6d5c-4b3a-4291-8f0e-1d2c3b4a5f6e",
  "task_id": "7c6b5a4d-3e2f-4b1a-9d8c-6f5e4d3c2b1a",
  "run_id": "3b0e8c1a-5d2f-4e6a-9c7b-1f2e3d4c5b6a",
  "department": "customer",
  "summary": "Bewertungen in SP liegen im üblichen Schwankungsbereich; ein Zusammenhang mit dem Lieferverzug ist noch nicht belegbar.",
  "statements": [
    {
      "text": "Ø Bewertung in SP seit dem 02.01.2018: 3,9 bei einem 28-Tage-Mittel von 4,1.",
      "numbers": [
        {
          "value": 3.9,
          "unit": null,
          "kpi": "review_score_avg"
        },
        {
          "value": 4.1,
          "unit": null,
          "kpi": "review_score_avg"
        }
      ],
      "evidence": [
        {
          "kind": "query",
          "ref": "/api/v1/kpis/review_score_avg/series?from=2017-12-13&to=2018-01-10&dim=region&members=SP"
        }
      ]
    }
  ],
  "hypotheses": [],
  "recommended_actions": [],
  "open_questions": [
    "Erneut prüfen, wenn Bewertungen der verspäteten Bestellungen vorliegen (ca. 7 Tage)."
  ],
  "no_cause_found": true,
  "usage": {
    "tokens_in": 6120,
    "tokens_out": 410,
    "cost_eur": 0.0,
    "duration_s": 27.9,
    "model": "mistral-small-latest"
  },
  "data_class": "public",
  "created_at": "2026-10-10T02:11:20Z"
}
